{"affected_surfaces":["app","cli","ide"],"assertions":{"all_distinct_clients_probed":true,"all_required_surfaces_measured":true,"external_beta_claimed":false,"manual_interaction_absent":true,"package_unchanged":true,"project_integrity_preserved":true},"bindings":{"baseline_matrix_sha256":"sha256:3ea6e925d98f4fd2c640479c985e5708d833266989d382b30f337d681da6156d","bundle_sha256":"sha256:752886b1d1b1e5db19ed72c325418979e7abc62ebfc00ed7b6c8aba80f917125","contract_projection_sha256":"sha256:c9598c10ad26f5d5fe5d7db20d6e25f6b1586ab5c078f60e2a771756ef568638","host_profile_sha256":"sha256:28c85a857d00880b8790ace9c9fd0acd0ab843be811d1ca870bfa78192bc4f47","measurement_sha256":"sha256:a6ad922e74aff66334efdbb9eeb0f4bdf4fbed53ef014cecb48ebdf9165dbcb4","package_manifest_sha256":"sha256:865d6b80b4c5ef62848514a4393f366d2ed3bf99105afe27bacdad20d0409c83","previous_profile_sha256":null,"smoke_report_sha256":["sha256:3a71673aa0c7e3b926210eb5d3fadb3d3df56c02d213eba7df537539b3add6e7","sha256:07020536cbcfc7b9525fc369957503bc2abc59b27e8fa678c8be0355c15f6631"]},"bundle":{"bundle_id":"host-delta-1-28c85a857d00","qualification":"supported","sequence":1},"delta_class":"interaction_sensitive","outcome":"compatible_bundle_issued","redaction":{"absolute_paths_absent":true,"account_identity_absent":true,"artifact_content_absent":true,"environment_secrets_absent":true},"required_probes":[],"schema_version":"s11-host-delta-receipt/1.0","status":"passed"}